{
  "$schema": "https://json-schema.org/draft/2020-12/schema",
  "title": "Tech-partnerships recon report",
  "type": "object",
  "required": ["kind", "unit", "namespace", "generated_at", "run_mode", "checks", "values_recomputed_from_target", "idempotency_rerun", "planted_anomaly_detections", "unverified_paths"],
  "properties": {
    "kind": {"const": "recon-report"},
    "unit": {"type": "string"}, "namespace": {"type": "string"}, "generated_at": {"type": "string", "format": "date-time"},
    "run_mode": {"enum": ["fixture", "live"]},
    "checks": {"type": "array", "minItems": 1, "items": {"type": "object", "required": ["id", "expected", "actual", "source_of_truth"], "properties": {"id": {"type": "string"}, "expected": {}, "actual": {}, "source_of_truth": {"type": "string"}, "result": {"enum": ["pass", "fail", "skipped"]}}}},
    "values_recomputed_from_target": {"type": "boolean"},
    "idempotency_rerun": {"type": "object", "required": ["performed", "result"], "properties": {"performed": {"type": "boolean"}, "result": {"enum": ["pass", "fail", "skipped"]}, "evidence": {"type": "string"}}},
    "planted_anomaly_detections": {"type": "object", "required": ["expected_set", "actual_set", "missing", "unexpected"], "properties": {"expected_set": {"type": "array"}, "actual_set": {"type": "array"}, "missing": {"type": "array"}, "unexpected": {"type": "array"}}},
    "unverified_paths": {"type": "array", "items": {"type": "string"}}
  }
}
