{
  "kind": "recon-report",
  "unit": "finance_excel_report",
  "namespace": "cnvfinance",
  "generated_at": "2026-08-18T00:25:23Z",
  "run_mode": "fixture",
  "checks": [
    {
      "id": "summary/EUR/CREDIT",
      "expected": "8|43269.62",
      "actual": "8|43269.62",
      "source_of_truth": "golden legacy CSV /home/ubuntu/tp-golden/cnvfinance/reports/finance_billing_20260115.csv vs Decimal recompute over /home/ubuntu/tp-golden/cnvfinance/parsed",
      "result": "pass"
    },
    {
      "id": "summary/EUR/INVOICE",
      "expected": "23|146588.31",
      "actual": "23|146588.31",
      "source_of_truth": "golden legacy CSV /home/ubuntu/tp-golden/cnvfinance/reports/finance_billing_20260115.csv vs Decimal recompute over /home/ubuntu/tp-golden/cnvfinance/parsed",
      "result": "pass"
    },
    {
      "id": "summary/GBP/CREDIT",
      "expected": "10|37930.19",
      "actual": "10|37930.19",
      "source_of_truth": "golden legacy CSV /home/ubuntu/tp-golden/cnvfinance/reports/finance_billing_20260115.csv vs Decimal recompute over /home/ubuntu/tp-golden/cnvfinance/parsed",
      "result": "pass"
    },
    {
      "id": "summary/GBP/INVOICE",
      "expected": "31|162322.68",
      "actual": "31|162322.68",
      "source_of_truth": "golden legacy CSV /home/ubuntu/tp-golden/cnvfinance/reports/finance_billing_20260115.csv vs Decimal recompute over /home/ubuntu/tp-golden/cnvfinance/parsed",
      "result": "pass"
    },
    {
      "id": "summary/USD/CREDIT",
      "expected": "8|54737.57",
      "actual": "8|54737.57",
      "source_of_truth": "golden legacy CSV /home/ubuntu/tp-golden/cnvfinance/reports/finance_billing_20260115.csv vs Decimal recompute over /home/ubuntu/tp-golden/cnvfinance/parsed",
      "result": "pass"
    },
    {
      "id": "summary/USD/INVOICE",
      "expected": "20|94945.18",
      "actual": "20|94945.18",
      "source_of_truth": "golden legacy CSV /home/ubuntu/tp-golden/cnvfinance/reports/finance_billing_20260115.csv vs Decimal recompute over /home/ubuntu/tp-golden/cnvfinance/parsed",
      "result": "pass"
    },
    {
      "id": "idempotency/recompute-stable",
      "expected": [
        [
          "EUR/CREDIT",
          [
            8,
            "43269.62"
          ]
        ],
        [
          "EUR/INVOICE",
          [
            23,
            "146588.31"
          ]
        ],
        [
          "GBP/CREDIT",
          [
            10,
            "37930.19"
          ]
        ],
        [
          "GBP/INVOICE",
          [
            31,
            "162322.68"
          ]
        ],
        [
          "USD/CREDIT",
          [
            8,
            "54737.57"
          ]
        ],
        [
          "USD/INVOICE",
          [
            20,
            "94945.18"
          ]
        ]
      ],
      "actual": [
        [
          "EUR/CREDIT",
          [
            8,
            "43269.62"
          ]
        ],
        [
          "EUR/INVOICE",
          [
            23,
            "146588.31"
          ]
        ],
        [
          "GBP/CREDIT",
          [
            10,
            "37930.19"
          ]
        ],
        [
          "GBP/INVOICE",
          [
            31,
            "162322.68"
          ]
        ],
        [
          "USD/CREDIT",
          [
            8,
            "54737.57"
          ]
        ],
        [
          "USD/INVOICE",
          [
            20,
            "94945.18"
          ]
        ]
      ],
      "source_of_truth": "second recompute over the same fixture-landed files",
      "result": "pass"
    }
  ],
  "values_recomputed_from_target": false,
  "idempotency_rerun": {
    "performed": true,
    "result": "pass",
    "evidence": "aggregation recomputed twice over fixture-landed files"
  },
  "planted_anomaly_detections": {
    "expected_set": [],
    "actual_set": [],
    "missing": [],
    "unexpected": []
  },
  "unverified_paths": [
    "fixture mode: SQL execution, Delta semantics, Unity Catalog, warehouse behaviour and volume transport are live checks (see the live recon report)"
  ]
}
