{
  "kind": "recon-report",
  "unit": "mongo_customers",
  "namespace": "demo",
  "generated_at": "2026-08-18T00:48:35Z",
  "run_mode": "fixture",
  "checks": [
    {
      "id": "customers-count",
      "expected": 25000,
      "actual": 25000,
      "source_of_truth": "testdata/legacy/manifests/demo.json",
      "result": "pass"
    },
    {
      "id": "customers-checksum",
      "expected": "4f92feef2ad58dbab30e289957931928",
      "actual": "4f92feef2ad58dbab30e289957931928",
      "source_of_truth": "testdata/legacy/manifests/demo.json (ordered PK+CUR_BAL_AMT md5, recomputed from target)",
      "result": "pass"
    },
    {
      "id": "eav-folded",
      "expected": 8333,
      "actual": 8333,
      "source_of_truth": "testdata/legacy/manifests/demo.json (sum of attributes entries across documents)",
      "result": "pass"
    },
    {
      "id": "csv-to-arrays",
      "expected": 0,
      "actual": 0,
      "source_of_truth": "no document carries a non-array related_acct_ids/promo_codes; malformed source lists are quarantined (see planted_anomaly_detections)",
      "result": "pass"
    },
    {
      "id": "dates-to-bson",
      "expected": 0,
      "actual": 0,
      "source_of_truth": "no document carries a non-BSON-date signup_dt; dirty source dates are quarantined (see planted_anomaly_detections)",
      "result": "pass"
    }
  ],
  "values_recomputed_from_target": true,
  "idempotency_rerun": {
    "performed": true,
    "result": "pass",
    "evidence": "rerun of migrate.py --ns demo after review round 6 fixes reproduced identical counts/checksum/anomaly sets (25000 customers, checksum 4f92feef2ad58dbab30e289957931928, 81 quarantined)"
  },
  "planted_anomaly_detections": {
    "expected_set": [
      "dirty_dates:50",
      "malformed_csv_lists:31"
    ],
    "actual_set": [
      "dirty_dates:50",
      "malformed_csv_lists:31"
    ],
    "missing": [],
    "unexpected": []
  },
  "unverified_paths": [
    "live Atlas run (run_mode=live): this unit self-verifies against a local fixture only; the parent runs the single live validation window",
    "invalid-UTF-8 quarantine path (invalid_encoding): no invalid bytes are planted in the estate and the Oracle driver decodes AL32UTF8 before the migration sees values, so this guard is untested end-to-end"
  ]
}
