{
  "kind": "recon-report",
  "unit": "cron-analytics",
  "namespace": "demo",
  "generated_at": "2026-08-17T05:28:09.474718Z",
  "run_mode": "fixture",
  "checks": [
    {
      "id": "LAND-01",
      "expected": 296,
      "actual": 296,
      "source_of_truth": ".tp-preflight/databricks-fixture/landing/Volumes/ow_tp/bronze/landing/cronbox/analytics/demo/2026-01-15/part-0000.jsonl",
      "result": "pass"
    },
    {
      "id": "LAND-02",
      "expected": {
        "records": 248,
        "non_json_bodies": 8
      },
      "actual": {
        "records": 248,
        "non_json_bodies": 8
      },
      "source_of_truth": ".tp-preflight/databricks-fixture/landing/Volumes/ow_tp/bronze/landing/cronbox/analytics/demo/2026-01-15/part-0000.jsonl",
      "result": "pass"
    },
    {
      "id": "LAND-03",
      "expected": {
        "records": 48,
        "2026-01-15": 32,
        "2026-01-14": 8,
        "2026-01-16": 8
      },
      "actual": {
        "records": 48,
        "2026-01-16": 8,
        "2026-01-15": 32,
        "2026-01-14": 8
      },
      "source_of_truth": ".tp-preflight/databricks-fixture/landing/Volumes/ow_tp/bronze/landing/cronbox/analytics/demo/2026-01-15/part-0000.jsonl",
      "result": "pass"
    },
    {
      "id": "LAND-04",
      "expected": 22,
      "actual": 22,
      "source_of_truth": ".tp-preflight/databricks-fixture/landing/Volumes/ow_tp/bronze/landing/cronbox/analytics/demo/2026-01-15/part-0000.jsonl",
      "result": "pass"
    },
    {
      "id": "LAND-05",
      "expected": {
        "titles": 15,
        "names": 13,
        "replacement_chars": 0
      },
      "actual": {
        "titles": 15,
        "names": 13,
        "replacement_chars": 0
      },
      "source_of_truth": ".tp-preflight/databricks-fixture/landing/Volumes/ow_tp/bronze/landing/cronbox/analytics/demo/2026-01-15/part-0000.jsonl",
      "result": "pass"
    },
    {
      "id": "LAND-06",
      "expected": true,
      "actual": true,
      "source_of_truth": ".tp-preflight/databricks-fixture/landing/Volumes/ow_tp/bronze/landing/cronbox/analytics/demo/2026-01-15/part-0000.jsonl",
      "result": "pass"
    }
  ],
  "values_recomputed_from_target": false,
  "idempotency_rerun": {
    "performed": true,
    "result": "pass",
    "evidence": "sha256:619dbdaecbccbf1c0f5acfcbed9be8ff905d1ad2f674c8557d7ff0e8625805a7 sha256:619dbdaecbccbf1c0f5acfcbed9be8ff905d1ad2f674c8557d7ff0e8625805a7"
  },
  "planted_anomaly_detections": {
    "expected_set": [
      [
        "dynamodb_adjacent_day_events",
        "2026-01-14",
        8
      ],
      [
        "dynamodb_adjacent_day_events",
        "2026-01-16",
        8
      ],
      [
        "malformed_sqs_bodies",
        "unparseable_json_body",
        8
      ],
      [
        "unicode_payloads",
        "Réunion café ☕",
        15
      ],
      [
        "unicode_payloads",
        "Δelta",
        13
      ],
      [
        "unknown_user_events",
        "unknown",
        22
      ]
    ],
    "actual_set": [
      [
        "dynamodb_adjacent_day_events",
        "2026-01-14",
        8
      ],
      [
        "dynamodb_adjacent_day_events",
        "2026-01-16",
        8
      ],
      [
        "malformed_sqs_bodies",
        "unparseable_json_body",
        8
      ],
      [
        "unicode_payloads",
        "Réunion café ☕",
        15
      ],
      [
        "unicode_payloads",
        "Δelta",
        13
      ],
      [
        "unknown_user_events",
        "unknown",
        22
      ]
    ],
    "missing": [],
    "unexpected": []
  },
  "unverified_paths": [
    "This fixture report proves transport/landing only.",
    "Every Spark SQL, Delta MERGE, gold aggregate, and Unity Catalog behaviour is proven only by the live recon the parent runs."
  ]
}
